[
  {
    "prompt_key": "completed_assessment_report",
    "audience": "participant",
    "report_type": "individual",
    "source_type": "single_test",
    "generator_type": "openai",
    "version": "v1",
    "is_active": true,
    "system_prompt": "Placeholder system prompt for package validation.",
    "user_prompt_template": "{\"instructions\":{\"dimension_hint_text\":\"{{dimension_hint_text}}\"},\"input\":{{prompt_input_json}}}",
    "output_schema_json": null,
    "notes": "Placeholder participant prompt template."
  },
  {
    "prompt_key": "completed_assessment_report",
    "audience": "hr",
    "report_type": "individual",
    "source_type": "single_test",
    "generator_type": "openai",
    "version": "v1",
    "is_active": true,
    "system_prompt": "Placeholder system prompt for package validation.",
    "user_prompt_template": "{\"instructions\":{\"dimension_hint_text\":\"{{dimension_hint_text}}\"},\"input\":{{prompt_input_json}}}",
    "output_schema_json": null,
    "notes": "Placeholder HR prompt template."
  }
]
